{
  "$schema": "../../schema/skill-package.schema.json",
  "id": "reproducible-research-packager",
  "version": "1.1.0",
  "distribution": "embedded",
  "license": "GPL-3.0-or-later",
  "entrypoint": "SKILL.md",
  "resources": {
    "playbook": "references/playbook.md",
    "report_template": "assets/report-template.md",
    "example_request": "examples/request.md",
    "example_output": "examples/expected-output.md",
    "example_report": "examples/example-report.md",
    "agent_metadata": "agents/openai.yaml"
  },
  "validation": {
    "command": "python3 scripts/validate_report.py REPORT.md",
    "test_command": "python3 tests/test_validate_report.py"
  },
  "execution": {
    "runtime": "python>=3.10",
    "network": "none",
    "filesystem": {
      "read": "package-and-user-supplied-inputs",
      "write": "explicit-output-paths-only"
    },
    "external_writes": false,
    "destructive": false
  },
  "extensions": {
    "executable": "scripts/assess.py",
    "test": "tests/test_assess.py",
    "reference": "references/executable-contract.md",
    "profile": "references/engine-profile.json",
    "schemas": [
      "schemas/assessment.schema.json"
    ],
    "fixtures": [
      "examples/fixtures/pass.json",
      "examples/fixtures/block.json"
    ]
  }
}
